{
  "schemaVersion": "1.0.0",
  "id": "official_EP_024",
  "revision": 1,
  "name": "초보 고객 온보딩 점검",
  "entryNodeId": "request",
  "inputs": {
    "type": "object",
    "properties": {
      "goal": {
        "type": "string",
        "minLength": 1,
        "maxLength": 2000
      },
      "sections": {
        "type": "array",
        "items": {
          "type": "object",
          "properties": {
            "id": {
              "type": "string",
              "minLength": 1,
              "maxLength": 80
            },
            "title": {
              "type": "string",
              "minLength": 1,
              "maxLength": 2000
            },
            "text": {
              "type": "string",
              "minLength": 1,
              "maxLength": 2000
            }
          },
          "required": [
            "id",
            "title",
            "text"
          ],
          "additionalProperties": false
        },
        "minItems": 1,
        "maxItems": 12
      },
      "intendedFirstTask": {
        "type": "string",
        "minLength": 1,
        "maxLength": 2000
      }
    },
    "required": [
      "goal",
      "sections",
      "intendedFirstTask"
    ],
    "additionalProperties": false
  },
  "outputs": {
    "type": "object",
    "properties": {
      "proposal": {
        "type": "object",
        "properties": {
          "findings": {
            "type": "array",
            "items": {
              "type": "object",
              "properties": {
                "id": {
                  "type": "string",
                  "minLength": 1,
                  "maxLength": 80
                },
                "sourceId": {
                  "type": "string",
                  "minLength": 1,
                  "maxLength": 80
                },
                "quote": {
                  "type": "string",
                  "minLength": 1,
                  "maxLength": 2000
                },
                "problem": {
                  "type": "string",
                  "minLength": 1,
                  "maxLength": 2000
                },
                "nextAction": {
                  "type": "string",
                  "minLength": 1,
                  "maxLength": 2000
                },
                "observationType": {
                  "const": "simulated_review"
                }
              },
              "required": [
                "id",
                "sourceId",
                "quote",
                "problem",
                "nextAction",
                "observationType"
              ],
              "additionalProperties": false
            },
            "minItems": 0,
            "maxItems": 20
          },
          "sectionCoverage": {
            "type": "array",
            "items": {
              "type": "object",
              "properties": {
                "sourceId": {
                  "type": "string",
                  "minLength": 1,
                  "maxLength": 80
                },
                "findingIds": {
                  "type": "array",
                  "items": {
                    "type": "string",
                    "minLength": 1,
                    "maxLength": 80
                  },
                  "minItems": 0,
                  "maxItems": 20
                },
                "adequateExplanation": {
                  "type": "boolean"
                }
              },
              "required": [
                "sourceId",
                "findingIds",
                "adequateExplanation"
              ],
              "additionalProperties": false
            },
            "minItems": 1,
            "maxItems": 12
          },
          "unassessed": {
            "type": "array",
            "items": {
              "type": "string",
              "minLength": 1,
              "maxLength": 2000
            },
            "minItems": 0,
            "maxItems": 8
          }
        },
        "required": [
          "findings",
          "sectionCoverage",
          "unassessed"
        ],
        "additionalProperties": false
      },
      "evaluation": {
        "type": "object",
        "properties": {
          "scores": {
            "type": "object",
            "properties": {
              "grounding": {
                "enum": [
                  0,
                  1
                ]
              },
              "coverage": {
                "enum": [
                  0,
                  1
                ]
              },
              "limits": {
                "enum": [
                  0,
                  1
                ]
              }
            },
            "required": [
              "grounding",
              "coverage",
              "limits"
            ],
            "additionalProperties": false
          },
          "passed": {
            "type": "boolean"
          },
          "evidence": {
            "type": "array",
            "items": {
              "type": "object",
              "properties": {
                "ruleId": {
                  "type": "string",
                  "minLength": 1,
                  "maxLength": 80
                },
                "reason": {
                  "type": "string",
                  "minLength": 1,
                  "maxLength": 2000
                }
              },
              "required": [
                "ruleId",
                "reason"
              ],
              "additionalProperties": false
            },
            "minItems": 3,
            "maxItems": 3
          }
        },
        "required": [
          "scores",
          "passed",
          "evidence"
        ],
        "additionalProperties": false
      }
    },
    "required": [
      "proposal",
      "evaluation"
    ],
    "additionalProperties": false
  },
  "modelProfiles": {
    "project-model": {
      "kind": "chat",
      "requiredFeatures": [
        "json_schema"
      ]
    }
  },
  "resources": {
    "er_026": {
      "id": "ER-026",
      "revision": 1,
      "kind": "instruction",
      "sha256": "39460e31511d4a3e87975b2a78508553209346f5072df3e0bc2a9a2ac4966c8a"
    },
    "er_013": {
      "id": "ER-013",
      "revision": 1,
      "kind": "instruction",
      "sha256": "8e4940b40db4e27776667ac7c489b3d7c9f3c457371911d5d64324165be6a4c8"
    },
    "practice": {
      "id": "EP-024-practice",
      "revision": 1,
      "kind": "document",
      "sha256": "a22d0801fa419c2a00c5fe82dd2b2ffed81e5be95ca17fc00d0913be75703cd3"
    }
  },
  "subworkflows": {},
  "nodes": [
    {
      "id": "request",
      "type": "form",
      "typeVersion": 1,
      "label": "원문과 작업 목적 입력",
      "inputBindings": {},
      "config": {
        "mode": "initial",
        "title": "초보 고객 온보딩 점검"
      },
      "attachments": [],
      "execution": {
        "timeoutMs": 60000,
        "retry": {
          "maxAttempts": 1,
          "backoffMs": 1000,
          "retryOn": []
        },
        "onError": "fail"
      }
    },
    {
      "id": "context",
      "type": "merge",
      "typeVersion": 1,
      "label": "원문과 고정 자료 연결",
      "inputBindings": {
        "request": {
          "from": "node",
          "nodeId": "request",
          "pointer": "/data",
          "onMissing": "error"
        }
      },
      "config": {
        "waitFor": "all_active",
        "combine": "object",
        "collision": "namespace"
      },
      "attachments": [],
      "execution": {
        "timeoutMs": 60000,
        "retry": {
          "maxAttempts": 1,
          "backoffMs": 1000,
          "retryOn": []
        },
        "onError": "fail"
      }
    },
    {
      "id": "draft",
      "type": "agent",
      "typeVersion": 1,
      "label": "초보 고객 온보딩 점검",
      "inputBindings": {
        "task": {
          "from": "node",
          "nodeId": "request",
          "pointer": "/data/goal",
          "onMissing": "error"
        },
        "context": {
          "from": "node",
          "nodeId": "context",
          "pointer": "/data",
          "onMissing": "error"
        }
      },
      "config": {
        "strategy": "task",
        "maxSteps": 1,
        "toolAllowlist": [],
        "modelProfile": "project-model",
        "resultSchema": {
          "type": "object",
          "properties": {
            "findings": {
              "type": "array",
              "items": {
                "type": "object",
                "properties": {
                  "id": {
                    "type": "string",
                    "minLength": 1,
                    "maxLength": 80
                  },
                  "sourceId": {
                    "type": "string",
                    "minLength": 1,
                    "maxLength": 80
                  },
                  "quote": {
                    "type": "string",
                    "minLength": 1,
                    "maxLength": 2000
                  },
                  "problem": {
                    "type": "string",
                    "minLength": 1,
                    "maxLength": 2000
                  },
                  "nextAction": {
                    "type": "string",
                    "minLength": 1,
                    "maxLength": 2000
                  },
                  "observationType": {
                    "const": "simulated_review"
                  }
                },
                "required": [
                  "id",
                  "sourceId",
                  "quote",
                  "problem",
                  "nextAction",
                  "observationType"
                ],
                "additionalProperties": false
              },
              "minItems": 0,
              "maxItems": 20
            },
            "sectionCoverage": {
              "type": "array",
              "items": {
                "type": "object",
                "properties": {
                  "sourceId": {